source_file,page,chunk_index,text
Kochi-Metro-Rail-Ltd_122025123422432.pdf,1,0,"Bid Details Bid End Date Time 20-02-2025 15:00:00 Bid Opening Date Time 20-02-2025 15:30:00 Bid Offer Validity (From End Date) ( ) 90 (Days) Ministry State Name ! Ministry Of Housing & Urban Affairs (mohua) Department Name Na Organisation Name Kochi Metro Rail Limited Office Name % Kochi Metro Rail Limited & Buyer Email mmt.kmrl@kerala.gov.in Item Category Financial Audit Services - As per ATC; Audit Firm Contract Period 3 Year(s) MSE Exemption for Years of Experience and Turnover , No Startup Exemption for Years of Experience and Turnover , 0 % No Document required from seller & 0 Certificate (Requested in ATC),Additional Doc 1 (Requested in ATC),Additional Doc 2 (Requested in ATC),Additional Doc 3 (Requested in ATC),Additional Doc 4 (Requested in ATC) In case any bidder is seeking exemption from Experience Turnover Criteria, the supporting documents to prove his eligibility for exemption must be uploaded for evaluation by the buyer Do you want to show documents uploaded by bidders to"
Kochi-Metro-Rail-Ltd_122025123422432.pdf,1,1,"ion from Experience Turnover Criteria, the supporting documents to prove his eligibility for exemption must be uploaded for evaluation by the buyer Do you want to show documents uploaded by bidders to all bidders participated in bid? Yes Bid to RA enabled 2 % 4& 4 No Type of Bid 5 Two Packet Bid Time allowed for Technical Clarifications during technical evaluation 6 0 8 7 Days Evaluation Method 6 9 Total value wise evaluation Bid Number & ( : ): GEM 2025 B 5848801 Dated 4 : 30-01-2025 Bid Document 0 1 5 ys fe GeM"
Kochi-Metro-Rail-Ltd_122025123422432.pdf,2,0,"Financial Document Indicating Price Breakup Required 6 % B 0 D F Yes Arbitration Clause No Mediation Clause No Bid Details EMD Detail Required F No ePBG Detail Required F No MII Compliance MII Compliance Yes MSE Purchase Preference MSE Purchase Preference Yes 1. Purchase preference to Micro and Small Enterprises (MSEs): Purchase preference will be given to MSEs as defined in Public Procurement Policy for Micro and Small Enterprises (MSEs) Order, 2012 dated 23.03.2012 issued by Ministry of Micro, Small and Medium Enterprises and its subsequent Orders Notifications issued by concerned Ministry. If the bidder wants to avail the Purchase preference for services, the bidder must be the Service provider of the offered Service. Relevant documentary evidence in this regard shall be uploaded along with the bid in respect of the offered service. If L-1 is not an MSE and MSE Service Provider (s) has have quoted price within L-1 15% of margin of purchase preference price band as defined in the rel"
Kochi-Metro-Rail-Ltd_122025123422432.pdf,2,1,"with the bid in respect of the offered service. If L-1 is not an MSE and MSE Service Provider (s) has have quoted price within L-1 15% of margin of purchase preference price band as defined in the relevant policy, then 100% order quantity will be awarded to such MSE bidder subject to acceptance of L1 bid price. The buyers are advised to refer to the OM No.1 4 2021 PPD dated 18.05.2023 for compliance of Concurrent application of Public Procurement Policy for Micro and Small Enterprises Order, 2012 and Public Procurement (Preference to Make in India) Order, 2017. Benefits of MSE will be allowed only if the credentials of the service provider are validated on- line in GeM profile as well as validated and approved by the Buyer after evaluation of submitted documents. 2. Estimated Bid Value indicated above is being declared solely for the purpose of guidance on EMD amount and for determining the Eligibility Criteria related to Turn Over, Past Performance and Project Past Experience etc. Thi"
Kochi-Metro-Rail-Ltd_122025123422432.pdf,2,2,"icated above is being declared solely for the purpose of guidance on EMD amount and for determining the Eligibility Criteria related to Turn Over, Past Performance and Project Past Experience etc. This has no relevance or bearing on the price to be quoted by the bidders and is also not going to have any impact on bid participation. Also this is not going to be used as a criteria in determining reasonableness of quoted prices which would be determined by the buyer based on its own assessment of reasonableness and based on competitive prices received in Bid RA process. Excel Upload Required G H 4 F : PRICE BREAK UP TO BE UPLOADED ALONG WITH FINANCIAL COVER ONLY - 1738241769.xlsx 2 5"
Kochi-Metro-Rail-Ltd_122025123422432.pdf,3,0,"Additional Qualification Data Required 2 I J F This Bid is based on Least Cost Method Based Evaluation (LCS). The technical qualification parameters are:- Parameter Name Max Marks Min Marks Evaluation Document Seller Document Required LCS CRITERIA for Technical Evaluation mentioned in Section 4 of ATC 100 75 View file Yes Total Minimum Passing Technical Marks: 75 Pre Bid Detail(s) Pre-Bid Date and Time Pre-Bid Venue 06-02-2025 11:00:00 Kochi Metro Rail Ltd. Corporate office 4th floor, JLN Stadium metro station, Kaloor, Kochi- 682017 Video call link: https: meet.google.com qao-itfn-iyb Financial Audit Services - As Per ATC; Audit Firm ( 1 ) Technical Specifications 8 Specification Values Core Scope of Work As per ATC Type of Financial Audit Partner Audit Firm Type of Financial Audit Internal Audit Category of Work under Financial Audit As per ATC Type of Industries Functions As per ATC Frequency of Progress Report QUARTERLY MIS Reporting for Financial Audit support Yes Frequency of MIS "
Kochi-Metro-Rail-Ltd_122025123422432.pdf,3,1,l Audit Category of Work under Financial Audit As per ATC Type of Industries Functions As per ATC Frequency of Progress Report QUARTERLY MIS Reporting for Financial Audit support Yes Frequency of MIS reporting as and when required State NA District NA Addon(s) Post Financial Audit Support NA Additional Specification Documents 2 I 8 0 3 5
Kochi-Metro-Rail-Ltd_122025123422432.pdf,4,0,"Consignees Reporting Officer 2 4 M S.No. &. . Consignee Reporting Officer 2 4 M Address To be set as 1 Additional Requirement 2 I F 1 Nithin N P 683106,DCO Stores, Muttom depot KMRL, Aluva 1 N A Buyer Added Bid Specific Terms and Conditions & O Q 1. Generic OPTION CLAUSE: The buyer can increase or decrease the contract quantity or contract duration up to 25 percent at the time of issue of the contract. However, once the contract is issued, contract quantity or contract duration can only be increased up to 25 percent. Bidders are bound to accept the revised quantity or duration 2. Buyer Added Bid Specific SLA File Attachment Click here to view the file. Disclaimer 0 The additional terms and conditions have been incorporated by the Buyer after approval of the Competent Authority in Buyer Organization, whereby Buyer organization is solely responsible for the impact of these clauses on the bidding process, its outcome, and consequences thereof including any eccentricity restriction arising"
Kochi-Metro-Rail-Ltd_122025123422432.pdf,4,1,"anization, whereby Buyer organization is solely responsible for the impact of these clauses on the bidding process, its outcome, and consequences thereof including any eccentricity restriction arising in the bidding process due to these ATCs and due to modification of technical specifications and or terms and conditions governing the bid. If any clause(s) is are incorporated by the Buyer regarding following, the bid and resultant contracts shall be treated as null and void and such bids may be cancelled by GeM at any stage of bidding process without any notice:- 1. Definition of Class I and Class II suppliers in the bid not in line with the extant Order Office Memorandum issued by DPIIT in this regard. 2. Seeking EMD submission from bidder(s), including via Additional Terms & Conditions, in contravention to exemption provided to such sellers under GeM GTC. 3. Publishing Custom BOQ bids for items for which regular GeM categories are available without any Category item bunched with it. 4"
Kochi-Metro-Rail-Ltd_122025123422432.pdf,4,2,"n contravention to exemption provided to such sellers under GeM GTC. 3. Publishing Custom BOQ bids for items for which regular GeM categories are available without any Category item bunched with it. 4. Creating BoQ bid for single item. 5. Mentioning specific Brand or Make or Model or Manufacturer or Dealer name. 6. Mandating submission of documents in physical form as a pre-requisite to qualify bidders. 7. Floating creation of work contracts as Custom Bids in Services. 8. Seeking sample with bid or approval of samples during bid evaluation process. (However, in bids for attached categories, trials are allowed as per approved procurement policy of the buyer nodal Ministries) 9. Mandating foreign international certifications even in case of existence of Indian Standards without specifying equivalent Indian Certification standards. 10. Seeking experience from specific organization department institute only or from foreign export experience. 11. Creating bid for items from irrelevant categ"
Kochi-Metro-Rail-Ltd_122025123422432.pdf,4,3,uivalent Indian Certification standards. 10. Seeking experience from specific organization department institute only or from foreign export experience. 11. Creating bid for items from irrelevant categories. 12. Incorporating any clause against the MSME policy and Preference to Make in India Policy. 13. Reference of conditions published on any external site or reference to external documents clauses. 4 5
Kochi-Metro-Rail-Ltd_122025123422432.pdf,5,0,"14. Asking for any Tender fee Bid Participation fee Auction fee in case of Bids Forward Auction, as the case may be. 15. Any ATC clause in contravention with GeM GTC Clause 4 (xiii)(h) will be invalid. In case of multiple L1 bidders against a service bid, the buyer shall place the Contract by selection of a bidder amongst the L-1 bidders through a Random Algorithm executed by GeM system. Further, if any seller has any objection grievance against these additional clauses or otherwise on any aspect of this bid, they can raise their representation against the same by using the Representation window provided in the bid details field in Seller dashboard after logging in as a seller within 4 days of bid publication on GeM. Buyer is duty bound to reply to all such representations and would not be allowed to open bids if he fails to reply to such representations. All GeM Sellers Service Providers are mandated to ensure compliance with all the applicable laws acts rules including but not limite"
Kochi-Metro-Rail-Ltd_122025123422432.pdf,5,1," allowed to open bids if he fails to reply to such representations. All GeM Sellers Service Providers are mandated to ensure compliance with all the applicable laws acts rules including but not limited to all Labour Laws such as The Minimum Wages Act, 1948, The Payment of Wages Act, 1936, The Payment of Bonus Act, 1965, The Equal Remuneration Act, 1976, The Payment of Gratuity Act, 1972 etc. Any non-compliance will be treated as breach of contract and Buyer may take suitable actions as per GeM Contract. This Bid is governed by the General Terms and Conditions R Q, conditons stipulated in Bid and Service Level Agreement specific to this Service as provided in the Marketplace. However in case if any condition specified in General Terms and Conditions R Q is contradicted by the conditions stipulated in Service Level Agreement, then it will over ride the conditions in the General Terms and Conditions. In terms of GeM GTC clause 26 regarding Restrictions on procurement from a bidder of a co"
Kochi-Metro-Rail-Ltd_122025123422432.pdf,5,2,"pulated in Service Level Agreement, then it will over ride the conditions in the General Terms and Conditions. In terms of GeM GTC clause 26 regarding Restrictions on procurement from a bidder of a country which shares a land border with India, any bidder from a country which shares a land border with India will be eligible to bid in this tender only if the bidder is registered with the Competent Authority. While participating in bid, Bidder has to undertake compliance of this and any false declaration and non-compliance of this would be a ground for immediate termination of the contract and further legal action in accordance with the laws. R , 26 % H 5 H H X 5 H 4 % ---Thank You R --- 5 5"
Kochi-Metro-Rail-Ltd_122025123422432.pdf,6,0,"Tender No: KMRL PROC TENDER 2024-25 090 30.01.2025 SECTION 1 INTRODUCTION 1. GENERAL a. Kochi Metro Rail Ltd. (KMRL) was created as a Special Purpose Vehicle (SPV) for the implementation, operation and maintenance of the metro project. KMRL is a joint venture of Government of India & Government of Kerala. KMRL has Completed the Phase I & Phase I extension of KMRL Project. The stations along the stretch are architecturally themed and are attracting substantial ridership. b. KMRL is also executing the Water Metro project, Integrated Urban generation and water transport system (IURWTS) project, Trivandrum & Kozhikode Metro Project. c. Proposals are invited for Engagement of Chartered Accountant Cost Accountant firm for Internal audit and other assignments for the years 2025-2028 in a single stage bidding process. d. The interested firms may download the tender document from the following websites www.gem.gov.in www.kmrl.co.in e. The intending Bidders must read the terms and conditions car"
Kochi-Metro-Rail-Ltd_122025123422432.pdf,6,1,"tage bidding process. d. The interested firms may download the tender document from the following websites www.gem.gov.in www.kmrl.co.in e. The intending Bidders must read the terms and conditions carefully and should only submit his tender if he considers himself eligible and he is in possession of all the documents required. f. The firms participating in the tender process hereafter will be called as Applicants Bidders Service Providers. g. The proposal should be submitted by bidders in two parts. The two parts of the proposal are Part 1: Technical Proposal and Part 2: Financial Proposal. Stage -1 of the Evaluation shall consider the evaluation of the Technical Proposal (i.e. Part 1). The firms qualifying evaluation of technical proposal as mentioned in tender document ATC shall only be considered for further evaluation. Under stage 2, the financial proposal of such firms as selected above shall be opened and evaluated. The applicants who has quoted lowest fee post correction of arit"
Kochi-Metro-Rail-Ltd_122025123422432.pdf,6,2,"considered for further evaluation. Under stage 2, the financial proposal of such firms as selected above shall be opened and evaluated. The applicants who has quoted lowest fee post correction of arithmetic error if any will be awarded the contract. 2. KEY DETAILS The applicants shall take note of the following key details in connection with submission of proposal:"
Kochi-Metro-Rail-Ltd_122025123422432.pdf,7,0,"a Name of Work Engagement of firm Chartered Accountant Cost Accountant for Internal audit and other assignments for the year 2025-2028 b Tender Security Amount (EMD- Earnest Money Deposit) Nil c Tender Processing Fee (Non Refundable) Nil d Date of publishing of tender 30.01.2025 e Email id for receiving queries and clarification queries@kmrl.co.in f Pre-bid meeting 06.02.2025 @ 11.00 hrs Kochi Metro Rail Ltd. Corporate office 4th floor, JLN Stadium metro station, Kaloor, Kochi- 682017 Video call link: https: meet.google.com qao- itfn-iyb g Clarification seeking end date 08.02.2025 @ 17.00 hrs h Tender submission end Date and Time Please refer GeM portal i Date & Time of opening of Tender Please refer GeM portal j Validity of Tender 90 days from the last date of submission of tender k Completion Period 3 financial years from 2025-2026 , 2026-2027 & 2027-2028 l Performance Security Nil m Authority and Place for submission of required documents (stamp paper documents & Bank guarantee only"
Kochi-Metro-Rail-Ltd_122025123422432.pdf,7,1,"etion Period 3 financial years from 2025-2026 , 2026-2027 & 2027-2028 l Performance Security Nil m Authority and Place for submission of required documents (stamp paper documents & Bank guarantee only) and seeking clarifications on tender documents General Manager (Procurement) Kochi Metro Rail Ltd, 4th Floor, JLN Metro Station, Kaloor-682017"
Kochi-Metro-Rail-Ltd_122025123422432.pdf,8,0,"SECTION 2 INSTRUCTION TO BIDDERS 1) Name of Work KMRL intends to Engage firm Chartered Accountant Cost Accountant for Internal audit and other assignments for the year 2025-2028. 2) Contract Period The contract will be valid for a period of 3 years from the date of issuance of the GeM Contract Order LoA or from 01.04.2025, whichever is later. Thereafter, upon reviewing satisfactory performance over the initial 3 years, the contract may be extended for another 2 years with 10% increase in the audit fees from fourth year, subject to discretion of the KMRL and satisfactory yearly performance of the firm. The successful Service Provider shall commence the service from 01 04 2025. 3) EMD (Tender Security Bid security) Nil Bidders are requested to provide Bid securing declaration as per Appendix 14 4) Performance security Nil 5) Bid validity 90 days from the last date of bid submission and to be extended as per the request from KMRL. 6) Contact Person Details Teeya Mary P J Designation: DGM "
Kochi-Metro-Rail-Ltd_122025123422432.pdf,8,1," 14 4) Performance security Nil 5) Bid validity 90 days from the last date of bid submission and to be extended as per the request from KMRL. 6) Contact Person Details Teeya Mary P J Designation: DGM (Finance) Contact No : 9746948554 7) Clarification and queries if any Queries can be e-mailed to queries@kmrl.co.in. Last date for seeking clarification: KMRL shall endeavor to respond to the queries within the period specified above. KMRL will post the reply to all such queries on the GeM portal and KMRL website. KMRL reserves the right not to respond to any queries or provide any clarifications, at its sole discretion, and nothing in this clause shall be construed as obliging KMRL to respond to any question or to provide any clarification. 8) The documents to be uploaded along with bid Duly filled, signed and sealed following appendices shall be submitted by bidders. a) Appendix 1- Tender index b) Appendix 2- Technical Proposal"
Kochi-Metro-Rail-Ltd_122025123422432.pdf,8,2,"filled, signed and sealed following appendices shall be submitted by bidders. a) Appendix 1- Tender index b) Appendix 2- Technical Proposal"
Kochi-Metro-Rail-Ltd_122025123422432.pdf,9,0,"PAN card, GST certificate and cheque copies need not be enclosed by bidder who have received Purchase work order from KMRL unless there are changes in the said credentials c) Appendix 3- Bidder Details d) PAN Card copy e) GST registration certificate f) Cancelled cheque copy g) Appendix 4- Schedule of compliance with scope of work h) Appendix 5- Schedule of compliance with tender terms & conditions i) Appendix 6: List of Partners as on 31.12.2024 (as per eligibility criteria) j) Appendix 7: Exposure of the firm in PSU being infrastructure company with Turnover more than 150 Crores under Central State government as Internal auditors in last five preceding year commencing from FY 2019-20 (as per eligibility criteria) k) Appendix 8: Experience in other Audit assignments in PSUs in Kerala l) Appendix 9: Annual turnover as per eligibility criteria m) Appendix 10: checklist for fulfillment of minimum eligibility criteria n) Appendix 11- Power of Attorney o) Appendix 12- Deleted p) Appendix 1"
Kochi-Metro-Rail-Ltd_122025123422432.pdf,9,1,"ppendix 9: Annual turnover as per eligibility criteria m) Appendix 10: checklist for fulfillment of minimum eligibility criteria n) Appendix 11- Power of Attorney o) Appendix 12- Deleted p) Appendix 13- Deleted q) Appendix 14- Undertaking for Tender security declaration r) Appendix 15- Undertaking that applicant is not blacklisted debarred as per Appendix 13. 9) Determination of responsiveness: Bid shall be considered as non-responsive & shall be rejected if the bidder fails to submit all the required documents as mentioned in the tender document. Prior to evaluation of Technical Proposals, KMRL will determine whether each Proposal is responsive to the requirements of the tender document. KMRL may, in its sole discretion, reject any Proposal that is not responsive hereunder. A Proposal shall be considered responsive only if: i. it is received by the Proposal Due Date including any extension thereof ii. it is accompanied by the Bid Security (if applicable). iii. applicants have submitte"
Kochi-Metro-Rail-Ltd_122025123422432.pdf,9,2,"ll be considered responsive only if: i. it is received by the Proposal Due Date including any extension thereof ii. it is accompanied by the Bid Security (if applicable). iii. applicants have submitted all documents as per tender requirement. iv. it is not non-responsive in terms hereof. KMRL reserves the right to reject any Proposal which is non-responsive and no request for alteration, modification, substitution or withdrawal shall be"
Kochi-Metro-Rail-Ltd_122025123422432.pdf,10,0,entertained by KMRL in respect of such proposals. 10) Award criteria The contract (LoA GeM Contract Order WO) will be awarded based on the technically accepted bid (in accordance with the LCS evaluation criteria outlined in Section 3 - Evaluation & Qualification Criteria of the tender document ATC) with least total cost (including all taxes & duties) and also considering the following factors: a) Correction of arithmetic errors if any. b) Application of Make in India Policy Unconditional acceptance of (LoA GeM Contract Order WO) must be furnished within 3 days of issue of same. 11) Variation in quantities during the contract period. The quantity mentioned in the BOQ is indicative. Actual quantity may vary upto 25% of the ordered quantity (rounded off to next whole number). 12) Signing of Agreement Deleted 13) Power of Attorney The Bidder shall submit a written power of attorney authorising the signatory (ies) of the Tender to commit the bidder. 14) Please be noted that no part of finan
Kochi-Metro-Rail-Ltd_122025123422432.pdf,10,1,"greement Deleted 13) Power of Attorney The Bidder shall submit a written power of attorney authorising the signatory (ies) of the Tender to commit the bidder. 14) Please be noted that no part of financial bid (price rates) should be reflected or disclosed in technical bid in any manner. If so found, the bid submitted will be summarily rejected. 15) TAXES AND DUTIES The bidder shall quote the price for the requirements and conditions mentioned in the tender. a) The price quoted shall be inclusive of GST and all other applicable taxes, duties and other charges. b) Transportation, packing, forwarding, installation and other charges if any, shall also be included in the quoted price. c) Contract price will be the total price quoted which is inclusive of all taxes and GST. d) The tax liability as per GST Act rests with the contractor, ambiguity if any regarding the percentage for that particular work or Services Accounting Code (SAC) HSN etc shall be cleared before offering of rates. e) Any"
Kochi-Metro-Rail-Ltd_122025123422432.pdf,10,2,"as per GST Act rests with the contractor, ambiguity if any regarding the percentage for that particular work or Services Accounting Code (SAC) HSN etc shall be cleared before offering of rates. e) Any liability on account of wrong classification of goods or services for arriving at taxes will be on the bidder. f) Lowest offer will be decided based on the overall lowest amount calculated with the basic price along with GST. g) Invoice as per GST Act should be furnished prior to every running account final bills. h) The GSTIN of Kochi Metro Rail Ltd is 32AAECK5274H1ZL"
Kochi-Metro-Rail-Ltd_122025123422432.pdf,11,0,i) GST at actuals shall be paid on the quoted corrected base value as per GST law in India after submission of appropriate GST invoices with GSTIN of the bidder and GSTIN of Kochi Metro Rail Ltd - 32AAECK5274H1ZL. j) Under GST law the contractor shall also comply regarding filing of all the returns to the GST network government departments within the stipulated time every month or such other period as required by the Government. If the contractor does not comply with any of the GST laws and procedures and if KMRL incurs any liability on this account or does not get the input credit from the GST Network Government as goods and or service receiver due to the contractor s failure to comply with the procedures of filing uploading of data submissions of documents etc in time then all such liability including the input credit of the GST lost by KMRL and the penalties and interest incurred by KMRL would be the liability of the contractor and the same shall be recovered either by recovery from
Kochi-Metro-Rail-Ltd_122025123422432.pdf,11,1,"lity including the input credit of the GST lost by KMRL and the penalties and interest incurred by KMRL would be the liability of the contractor and the same shall be recovered either by recovery from security deposits any other amount payable by the contractor to KMRL or through direct payment. The contractor shall submit the copy of latest filed return - GSTR1 along with the invoice. 16) GENERAL a. The intending Bidders must read the terms and conditions carefully and should only submit his tender if he considers himself eligible and he is in possession of all the documents required. b. The applicant is required to examine carefully all the contents of the tender document including addenda corrigenda, instructions, conditions, forms, terms, specifications and take them fully into account before submitting the bid. Failure to comply with the requirement(s) of tender document will be at the Bidder s own risk & responsibility. c. Kochi Metro Rail Ltd. (KMRL) will not be responsible for "
