source_file,page,chunk_index,text
Kochi-Metro-Rail-Ltd_122025123422432.pdf,11,2," before submitting the bid. Failure to comply with the requirement(s) of tender document will be at the Bidder s own risk & responsibility. c. Kochi Metro Rail Ltd. (KMRL) will not be responsible for any delays reasons what so ever in receiving as well as submitting offers, including connectivity issues. d. Kochi Metro Rail Ltd. (KMRL) will not be responsible for the cost incurred in preparation and submission of bids including the cost of digital certificate, regardless of the conduct of outcome of the bidding process. e. Kochi Metro Rail Ltd. (KMRL) reserves the right to accept any offer in whole or in part or reject any or all offers without assigning any reason. Decision of KMRL in this regard shall be final and binding on the bidder."
Kochi-Metro-Rail-Ltd_122025123422432.pdf,12,0,"SECTION 3 SCOPE OF WORK DETAILS OF WORKS TO BE IMPLEMENTED BY THE CONSULTANT A. The Assignment includes Internal Audit Pre Audit of Payment Vouchers above the threshold limit set by KMRL from time to time (at present limit is Rs. 1 lakh). Certification Verification works Special Audit assignment B. SCOPE OF INTERNAL AUDIT The assignment of Internal Audit shall be done on concurrent basis headed by at least one qualified Chartered Cost Accountant who can be replaced only with prior approval of KMRL along with required personnel who must be at least semi qualified. The audit firm shall employ such more qualified and experienced personnel as and when required for internal audit. The firm shall furnish the list of personnel deputed for audit with details before commencement of audit. The list shall be reviewed and approved by KMRL with or without modification. Except as KMRL may otherwise agree, no change shall be made in the approved list of personnel. If for any reason beyond the reasona"
Kochi-Metro-Rail-Ltd_122025123422432.pdf,12,1,"shall be reviewed and approved by KMRL with or without modification. Except as KMRL may otherwise agree, no change shall be made in the approved list of personnel. If for any reason beyond the reasonable control of the Audit Firm, it becomes necessary to replace any of the Personnel, the Audit Firm shall forthwith provide as a replacement, a person of equivalent or superior qualification with the prior approval of KMRL. C. OBJECTIVE To monitor the achievement of organizational objectives. To identify, assess and suggest to manage risks to those objectives. To ensure compliance with manuals, policies, delegation of powers, laws and regulations including all statutory requirements. Review of operations to assure whether the operations are conducted economically and efficiently. To assure whether the systems, procedures, adopted by the company are adequate and effective to achieve company s objectives and goals. To assure the compliances of legal, regulatory, accounting standards, policie"
Kochi-Metro-Rail-Ltd_122025123422432.pdf,12,2,"ther the systems, procedures, adopted by the company are adequate and effective to achieve company s objectives and goals. To assure the compliances of legal, regulatory, accounting standards, policies and prescribed"
Kochi-Metro-Rail-Ltd_122025123422432.pdf,13,0,"procedures. To add value to improve the company s operations. To review the efficacy, adequacy and application of accounting, financial and operating controls and thereby ensure the accuracy of the books of accounts; Verify that the system of internal check is effective in design and operation in order to ensure the prevention of and early detection of defalcations, frauds, misappropriations and misapplications; Identify areas of significant inefficiencies in existing systems and suggest necessary remedial measures; To evaluate and improve the effectiveness of risk management control and governance processes. D. EXTENT OF COVERAGE OF INTERNAL AUDIT The illustrative (but not exhaustive) list of tasks to be performed for Internal Audit by Practicing Audit Firm Partnership Proprietorship Individual is given as under: - Sl. No. Particulars Frequency 1 Verification of all accounting vouchers 75% 2 Review of all expenses as per delegation of powers, supporting documents, statutory deductions"
Kochi-Metro-Rail-Ltd_122025123422432.pdf,13,1,"vidual is given as under: - Sl. No. Particulars Frequency 1 Verification of all accounting vouchers 75% 2 Review of all expenses as per delegation of powers, supporting documents, statutory deductions, head of accounts etc. 75% 3 Payments to project vendors with reference to compliance with the contract agreement, compliance of foreign exchange payments etc 100% 4 Pre audit of payment vouchers as per threshold limit set by KMRL 100% 5 Verification of Bank Reconciliation statement. 100% 6 Verification of statutory payments, filing of returns etc 100% 7 Review of the Fixed Assets Register, Physical verification of the all Fixed assets on perpetual inventory verification system, so as to cover all assets over a period of three years Once in a financial year"
Kochi-Metro-Rail-Ltd_122025123422432.pdf,14,0,"8 Physical verification of Inventory spares at head office stations depot & issue of report twice in a financial year 9 Review of revenue accounting from stations head office 1) Fare Box 2) Non fare box 3) Lease Rental income Advertisement property development station oriented development and any other income 4) Interest earned from short term deposit 5) Consultancy income 6) Revenue leakage, if any 100% 10 Ensuring compliance with the SOP s on Revenue Procedures at stations including physical verification of cash at stations Quarterly 11 Special Audit of all contracts (from RFP till execution) Contracts with value upto Rs. 25 lakh Contracts with value above Rs. 25 lakh 50% 100% 12 Special Audit of Procurement of stores spares miscellaneous (from RFP till execution) Contracts with value upto Rs. 5 lakh Contracts with value above Rs.5 lakh 50% 100% 13 Special Audit of contracts PO awarded on single tender and nomination basis Contracts with value upto Rs. 5 lakh Contracts with value abo"
Kochi-Metro-Rail-Ltd_122025123422432.pdf,14,1,to Rs. 5 lakh Contracts with value above Rs.5 lakh 50% 100% 13 Special Audit of contracts PO awarded on single tender and nomination basis Contracts with value upto Rs. 5 lakh Contracts with value above Rs. 5 lakh 50% 100% 14 HR Department Monthly salary payments including statutory deductions Recoveries Leave records Claims Any other areas not listed above 100%
Kochi-Metro-Rail-Ltd_122025123422432.pdf,15,0,"15 Audit of stores depot spares department (verification of documentation, procedures, adherence to SOP s) Half yearly 16 Verification of valuation of closing stock Half yearly 17 Verification of title deeds of land 100% 18 Verification certification of documents submitted towards reimbursement procedure fund utilization of external domestic borrowings foreign remittance for any other purpose 100% 19 Compliance of manuals, standard operating procedures, delegation of powers. 100% 20 Verification & Filing of all statutory returns (IT, TDS, GST PF etc) 100% 21 Orientation program by Senior partner on new laws, amendments or any other relevant matters as applicable to KMRL twice in a financial year 22 Assist in finalization of accounts Quarterly yea rly 23 Ensuring compliance with the Audit Manual Accounting manual of KMRL. 100% 24 To ensure adequacy of various manuals in the company and advise modifications to the management from time to time. On needs basis 25 Analysis of Sundry Debtors"
Kochi-Metro-Rail-Ltd_122025123422432.pdf,15,1,"anual Accounting manual of KMRL. 100% 24 To ensure adequacy of various manuals in the company and advise modifications to the management from time to time. On needs basis 25 Analysis of Sundry Debtors Sundry creditors Loans and sub debts Expenses Income CWIP etc. Quarterly 26 Advise on Ind AS, Direct & Indirect Tax related Matters 100% 27 Verification of Fixed asset capitalization workings as and when asset capitalization take place 100% E. REPORTING REQUIREMENTS INTERNAL AUDIT The internal audit is to be carried out and report to be submitted on quarterly basis within Twenty days of the close of each quarter. The auditor has to highlight the critical issues immediately to the Management, which require immediate attention. The audit report shall be issued to Director Finance, KMRL. The report shall be submitted on-line in soft as well as hard copies. KMRL may prescribe separate forms, if any, applicable for furnishing the audit reports on-line."
Kochi-Metro-Rail-Ltd_122025123422432.pdf,15,2,"ort shall be submitted on-line in soft as well as hard copies. KMRL may prescribe separate forms, if any, applicable for furnishing the audit reports on-line."
Kochi-Metro-Rail-Ltd_122025123422432.pdf,16,0,"All work done by the Internal Audit Service should be properly documented, evidenced and filed for any reference. The auditor shall obtain, maintain and submit sufficient audit working papers as evidence to the Employer for support of their findings and audit opinion. The documentation shall comply with the guidelines prescribed by the ICAI ICMAI. On completion of the audit, the auditor shall follow steps before finalization of the audit report, i. The preliminary audit observation shall be first discussed with the Finance officer nominated by KMRL for coordinating the audit along with the head of the department. ii. The observation of the audit shall be prepared after seeking clarifications from the finance department iii. Based on the preliminary audit observation and after discussions, a final report shall be complied prepared The report should be structured in a manner to provide the following: i. Audit observations ii. Risk and Implications of the observations iii. Recommendations"
Kochi-Metro-Rail-Ltd_122025123422432.pdf,16,1,"a final report shall be complied prepared The report should be structured in a manner to provide the following: i. Audit observations ii. Risk and Implications of the observations iii. Recommendations iv. Management comments v. Audit observation on the management comments In addition to above, report on the action taken on previous recommendations observations shall be incorporated. F. SCOPE OF PRE-AUDIT The audit compliance includes the 100% pre-audit of vendors bill valuing more than the threshold limit fixed by KMRL (At present Rs. 1 lakh) and detailed pre-audit verification of the final bill of the contractors for the project activity within the time frame as per KMRL existing policy & procedures. Only with auditor certification, the payment will be released to the contractors on such bills. It also includes verification of final settlement of employees at the time of resignation retirement. The pre audit team must include persons with a minimum qualification of CA ICWA inter to co"
Kochi-Metro-Rail-Ltd_122025123422432.pdf,16,2,bills. It also includes verification of final settlement of employees at the time of resignation retirement. The pre audit team must include persons with a minimum qualification of CA ICWA inter to conduct the pre-audit of accounts of the company. The scope of pre-audit includes -
Kochi-Metro-Rail-Ltd_122025123422432.pdf,17,0,"i) To ensure approvals as per delegation of power. ii) To verify and scrutinize payments to contractors with reference to respective agreements and adjustment thereof while accounting for the work done by them and ensure that deductions in respect of mobilization & other advances, Statutory deductions, etc. are correctly made from the bills. Also verify that all vendor accounts are reconciled from time to time. iii) To verify work-in-progress with reference to field records such as Interim payment certificates and certification of progress issued by the executive, quantum of work-in- progress recorded should be compared with work orders contracts and subsequent approvals for variations, to ensure that payments are duly authorized. iv) To check that adjustments for returns, shortages, damages and unserviceable stores and materials at sites are properly made. v) To review terms and conditions of tender documents and agreements, verification of bank guarantees, insurance policies and spec"
Kochi-Metro-Rail-Ltd_122025123422432.pdf,17,1,"es and unserviceable stores and materials at sites are properly made. v) To review terms and conditions of tender documents and agreements, verification of bank guarantees, insurance policies and specific emphasis to be given on final payments. vi) To plug loopholes, which might have creeped in the system due to passage of time and complacency on the part of persons particularly, engaged in financial concurrences, release of payments, updating accounting records, authorizations as per Financial Accounting System etc. vii) Pre audit of payment vouchers shall be completed within two days of receipt of request from KMRL. In case of urgent payments pre audit shall be completed within same day. G. MINIMUM MANDAYS PER QUARTER The minimum number of man-days required to be spent per quarter on internal audit and pre audit at KMRL by various categories of audit staffs are given below. However, the bidder can increase these man-days according to his assessment of work. If the actual number of ma"
Kochi-Metro-Rail-Ltd_122025123422432.pdf,17,2,"ernal audit and pre audit at KMRL by various categories of audit staffs are given below. However, the bidder can increase these man-days according to his assessment of work. If the actual number of man-days attended by any category of audit staff falls below the quoted number of days, the remuneration shall be reduced accordingly. In any case, the auditor has to ensure that the optimum number of man-days is spent on internal audit of KMRL. Necessary attendance register will be maintained by KMRL for this purpose. Daily Audit Team shall include minimum one Semi qualified assistant and one Junior Articled clerk."
Kochi-Metro-Rail-Ltd_122025123422432.pdf,18,0,"Sl. No. Particulars Partner Qualified assistant Semi- qualified assistant Junior articled clerk Internal audit at head office depot station 2 5 60 60 Pre Audit at Head Office 75 75 Note 1. A presence of not less than 4 hours by partners , 5 hours by fully qualified assistant, 8 hours by Semi-qualified Junior articled clerk shall be deemed as one man day The remuneration shall be paid quarter wise after completion of the audit on submission of the audit report and other reports specifically asked by KMRL, if any, and on submission of a bill by the firm. GST as applicable shall be paid extra as per extant laws. No TA or DA or food expenses or out of pocket expenses will be paid for the assignment. The bidder shall carry its own system for executing the work. In the event of outstation travel (as approved by KMRL), TA DA as per KMRL travel policy shall be reimbursed. Partner Qualified Assistant shall be equated to the level of E7 E4 and other audit staff to the level of E0."
Kochi-Metro-Rail-Ltd_122025123422432.pdf,18,1," (as approved by KMRL), TA DA as per KMRL travel policy shall be reimbursed. Partner Qualified Assistant shall be equated to the level of E7 E4 and other audit staff to the level of E0."
Kochi-Metro-Rail-Ltd_122025123422432.pdf,19,0,"SECTION 4 EVALUATION AND QUALIFICATION CRITERIA 1. ELIGIBLE APPLICANTS The tenders for this contract will be considered only from those bidders who meet requisite eligibility criteria prescribed as under: i. A bidder shall submit only one bid in the same tendering process. A bidder who submits or participates in more than one bid will cause all the proposals in which the bidder has participated to be disqualified. No bidder can be a subcontractor while submitting a bid individually. A bidder, if acting in the capacity of subcontractor in any bid, may participate in more than one bid, but only in that capacity. ii. Bidders shall not have a conflict of interest. All Bidders found to have a conflict of interest, shall be disqualified. Bidders shall be considered to have a conflict of interest with one or more parties in this bidding process, if: a. bidder has been engaged by the Employer to provide consulting services for the preparation related to procurement for on implementation of the"
Kochi-Metro-Rail-Ltd_122025123422432.pdf,19,1," with one or more parties in this bidding process, if: a. bidder has been engaged by the Employer to provide consulting services for the preparation related to procurement for on implementation of the project. b. bidder is any associates affiliates (inclusive of parent firms) mentioned in subparagraph (a) above; or c. a bidder lends, or temporarily seconds its personnel to firms or organizations which are engaged in consulting services for the preparation related to procurement for on implementation of the project, if the personnel would be involved in any capacity on the same project. iii. A firm, who has purchased the tender document in their name, can submit the tender. iv. Any entity which has been barred blacklisted by the Government of India, any State Government, a statutory authority or a Public-Sector Undertaking, as the case may be, from participating in any project, and the bar blacklist subsists as on the date of Proposal, would not be eligible to submit a Proposal either b"
Kochi-Metro-Rail-Ltd_122025123422432.pdf,19,2,"ty or a Public-Sector Undertaking, as the case may be, from participating in any project, and the bar blacklist subsists as on the date of Proposal, would not be eligible to submit a Proposal either by itself or through its Associate. 2. MINIMUM ELIGIBILITY CRITERIA: The Applicant shall meet the following minimum eligibility criteria for participation in this Tender Process. The bidders who do not qualify the minimum eligibility criteria shall not be considered for evaluation."
Kochi-Metro-Rail-Ltd_122025123422432.pdf,20,0,"SL No. Minimum Eligibility Requirement Supporting Document to be submitted (i) Legal Status of the Bidder and experience of Firm: The Bidder should be a Partnership Firm LLP of Chartered Accountants Cost Accountants registered in India having experience of 10 (Ten) years or more. Self-attested copy of Registration certificate issued by Institute of Chartered Accountants of India Institute of Cost Accountants of India. (ii) Financial Capacity The Bidder should have average annual gross receipts turnover excluding GST (total of consultancy fee, filing fee etc. charged in the process of usual business but excluding other Income) of Rs.50,00,000 (Rupees Fifty Lakh) for last 5 (five) completed financial years. 2019-20 to 2023-24. Audited financial statements of the firm (Balance Sheet & Statement of Profit and Loss) duly self-certified. Bidder shall submit certificate as per appendix 9 (iii) Experience of Partners The Bidder should have minimum 4 (four) full time qualified partners associat"
Kochi-Metro-Rail-Ltd_122025123422432.pdf,20,1,"nt of Profit and Loss) duly self-certified. Bidder shall submit certificate as per appendix 9 (iii) Experience of Partners The Bidder should have minimum 4 (four) full time qualified partners associated with the firm. Of which, at least 2 (two) full time CA CMA should have association of 5 Years or more with the firm LLP. List of the partners (as per Appendix 6) along with the resume giving the brief details of relevant experience of Internal audit and the membership No. The list should be attested by Managing Partner Senior Partner establishing the fulfilment of criteria. The resume should separately mention the work done and period of experience in Internal Audit. (iv) Assignment Undertaken Should have undertaken Internal audit assignments of at least 1 (one) Central State PSU or Listed Public Limited Company Private Company having Mandatory Ind-AS applicability and annual turnover of Rs.150 crores or more of at least one year in the last five (5) financial years. Note: Bank audits &"
Kochi-Metro-Rail-Ltd_122025123422432.pdf,20,2,"Public Limited Company Private Company having Mandatory Ind-AS applicability and annual turnover of Rs.150 crores or more of at least one year in the last five (5) financial years. Note: Bank audits & Branch Audit will not be considered for the above purpose. List of assignment (as per Appendix 7) showing the organization name, financial year for which assignment undertaken, date of completion of assignment and turnover of the organization audited and Ind-AS Application reason for the relevant F.Y. duly certified by the Managing Partner Senior Partner. Offer letter in the letter head , any one invoice and supporting document of receipt of payment against such invoice should be provided as Proof of execution of services."
Kochi-Metro-Rail-Ltd_122025123422432.pdf,21,0,"(v) The firm should have a Registered Office branch in Kochi region. Proof as per ICAI ICMAI records to be attached. Self-attested copy of Registration Certificate issued by Institute of Chartered Accountants of India Institute of Cost Accountants of India along with proof of address. (vi) The bidder should not have been debarred black listed disqualified by any regulators statutory body in India. Self-declaration as per Appendix 15 3. LCS (Least Cost Selection) CRITERIA for Technical Evaluation First of all, it will be determined whether each tender is responsive as per Section 4, clause 2 - Minimum Eligibility Criteria. The bidders who do not qualify the minimum eligibility criteria shall not be considered for LCS evaluation method. The Bids, which are not considered substantially responsive shall be rejected and shall not be allowed subsequently to be made responsive by correction or withdrawal of the nonconforming deviation or reservation. Bids that are deemed responsive based on t"
Kochi-Metro-Rail-Ltd_122025123422432.pdf,21,1,"sive shall be rejected and shall not be allowed subsequently to be made responsive by correction or withdrawal of the nonconforming deviation or reservation. Bids that are deemed responsive based on the eligibility criteria and tender requirements will be evaluated according to the Selection Criteria outlined in Annexure A. The bidders, who secure 75 marks and above as per Scoring Criteria will be declared as technically qualified bidders and price bid will be opened for them only. The offers who are qualifying as per these technical evaluation criteria will only be considered as technically responsive, and the rest would be considered technically nonresponsive and would be disqualified from further evaluation. The decision of the KMRL as to which of the bids are not substantially responsive and scoring as per table below shall be final. ANNEXURE A Sl. No. Evaluation Criteria Marks 1) Legal Status of the Bidder 20 Minimum marks for 10 years experience will be 15. For each additional fu"
Kochi-Metro-Rail-Ltd_122025123422432.pdf,21,2,"ve and scoring as per table below shall be final. ANNEXURE A Sl. No. Evaluation Criteria Marks 1) Legal Status of the Bidder 20 Minimum marks for 10 years experience will be 15. For each additional full year of experience, additional 1 mark will be awarded subject to maximum of 20 marks. Counted from the date of constitution of the firm LLP with one full time FCA or date of joining of the firm LLP by the existing partner having the longest association with the firm LLP whichever is later.(Such date will be considered as Formation date of the firm) 2) Financial Capacity 20"
Kochi-Metro-Rail-Ltd_122025123422432.pdf,22,0,"Minimum marks for having average annual turnover receipts of Rs.50,00,000 in the last five(5) completed financial years will be 15. For each additional Rs.50 Lakh average turnover receipts, additional 1 mark will be awarded subject to maximum of 20 marks. 3) Experience of Partners 30 Minimum marks for the criteria (clause 2.iii of Minimum eligibility criteria) will be 20 The firm having additional partner with post qualification experience and association with firm of 10 years or more will be awarded two additional mark for each additional partner subject to maximum of 30 marks. 4) Assignment Undertaken 30 Minimum marks for undertaking Internal Audit assignment of at least 1(one) Central State PSU Listed Public Limited Company Private company having mandatory Ind-AS applicability and annual turnover of Rs.150 crores or more of at least one year in the last five (5) financial year will be 20. For each additional internal audit assignment meeting the criteria handled for a continuous per"
Kochi-Metro-Rail-Ltd_122025123422432.pdf,22,1,"l turnover of Rs.150 crores or more of at least one year in the last five (5) financial year will be 20. For each additional internal audit assignment meeting the criteria handled for a continuous period of atleast one year during last five (5) financial years, additional 2 mark will be awarded subject to maximum of 30 marks Each company audit assignment will be considered only once although audit assignment was carried out for more than one year Note: 1. Bank Audits and Branch Audits of PSUs will not be considered. 2. Supporting documents as per respective forms shall be submitted. 4. EVALUATION OF FINANCIAL PROPOSAL Bidders who do not meet the technical evaluation criteria will be excluded from the financial bid opening process. Financial proposals will only be opened for eligible and responsive offers. The L-1 bidder, determined from the responsive offers, will be selected without additional weighting based on the Technical proposal's marks or ranking. The contract will be awarded t"
Kochi-Metro-Rail-Ltd_122025123422432.pdf,22,2,"sponsive offers. The L-1 bidder, determined from the responsive offers, will be selected without additional weighting based on the Technical proposal's marks or ranking. The contract will be awarded to the bidder offering the L-1 (Lowest Evaluated Tender Price), after any necessary corrections for arithmetical errors, provided the quoted amount is deemed acceptable."
